press_release_id,release_date,company_name,category,source,source_url,cid,category_name,cat_sim,cat_margin,decision,title,snippet,run_id,taxonomy_version,p1_emb,p1_lsa,entropy_emb,entropy_lsa,entropy_fused,top3_fused_sum,agreement_emb_lsa,cid_group,cat_sim_group,cat_margin_group,entropy_fused_group,dup_group_id,dup_group_size,is_group_rep,sample_weight_dedup,decision_group,top3_cids,top3_probs
198aa0fb23c6811f,2025-08-14,Nordea Bank Oyj,unknown,gmail,,share_buyback,Share buyback,0.0589,0.0025,needs_review_low_sim,Omien osakkeiden takaisinosto 14.08.2025,"Omien osakkeiden takaisinosto 14.08.2025 Julkaistu: 2025-08-14 21:30:00 CEST COMPANY - Muutokset omien osakkeiden omistuksessa COMPANY: Omien osakkeiden takaisinosto 14.08.2025 COMPANY Pörssitiedote - Muutokset omien osakkeiden omistuksessa 14.08.2025 klo 22.30 Suomen aikaa COMPANY (LEI: 529900ODI3047E2LIV03) on 14.08.2025 hankkinut omia osakkeitaan (ISIN: FI4000297767) omistukseensa seuraavasti: Markkinapaikka (MIC-koodi) Osakkeiden lukumäärä Painotettu keskihinta osakkeelta, euroa* ** Kulut yhteensä, euroa * ** XHEL 133 553 13,58 1 813 022,04 XSTO 119 829 13,58 1 627 861,47 XCSE 13 143 13,58",2025-09-02T130606Z,v3,0.0548,0.065,2.9443,2.9423,2.9439,0.168,True,share_buyback,0.0589,0.0025,2.9439,g00000452,1,True,1.0,needs_review_low_sim,"[""share_buyback"", ""equity_actions_non_buyback"", ""dividend""]","[0.0589, 0.0564, 0.0527]"
198e7dbece2e3491,2025-08-26,Nordea Bank Oyj,unknown,gmail,,share_buyback,Share buyback,0.0589,0.0025,needs_review_low_sim,Omien osakkeiden takaisinosto 26.08.2025,"Omien osakkeiden takaisinosto 26.08.2025 Julkaistu: 2025-08-26 21:30:00 CEST COMPANY - Muutokset omien osakkeiden omistuksessa COMPANY: Omien osakkeiden takaisinosto 26.08.2025 COMPANY Pörssitiedote - Muutokset omien osakkeiden omistuksessa 26.08.2025 klo 22.30 Suomen aikaa COMPANY (LEI: 529900ODI3047E2LIV03) on 26.08.2025 hankkinut omia osakkeitaan (ISIN: FI4000297767) omistukseensa seuraavasti: Markkinapaikka (MIC-koodi) Osakkeiden lukumäärä Painotettu keskihinta osakkeelta, euroa* ** Kulut yhteensä, euroa * ** XHEL 136 481 13,26 1 809 997,37 XSTO 122 405 13,29 1 627 258,71 XCSE 13 434 13,28",2025-09-02T130606Z,v3,0.0548,0.0651,2.9443,2.9423,2.9438,0.1681,True,share_buyback,0.0589,0.0025,2.9438,g00000453,1,True,1.0,needs_review_low_sim,"[""share_buyback"", ""equity_actions_non_buyback"", ""agm_egm_governance""]","[0.0589, 0.0564, 0.0528]"
198ce1c2e8109c45,2025-08-21,Nordea Bank Oyj,unknown,gmail,,share_buyback,Share buyback,0.0592,0.0026,needs_review_low_sim,Omien osakkeiden takaisinosto 21.08.2025,"Omien osakkeiden takaisinosto 21.08.2025 Julkaistu: 2025-08-21 21:30:00 CEST COMPANY - Muutokset omien osakkeiden omistuksessa COMPANY: Omien osakkeiden takaisinosto 21.08.2025 COMPANY Pörssitiedote - Muutokset omien osakkeiden omistuksessa 21.08.2025 klo 22.30 Suomen aikaa COMPANY (LEI: 529900ODI3047E2LIV03) on 21.08.2025 hankkinut omia osakkeitaan (ISIN: FI4000297767) omistukseensa seuraavasti: Markkinapaikka (MIC-koodi) Osakkeiden lukumäärä Painotettu keskihinta osakkeelta, euroa* ** Kulut yhteensä, euroa * ** XHEL 135 961 13,33 1 812 781,61 XSTO 122 055 13,34 1 627 772,62 XCSE 13 390 13,33",2025-09-02T130606Z,v3,0.0548,0.0657,2.9443,2.9421,2.9438,0.1685,True,share_buyback,0.0592,0.0026,2.9438,g00000454,1,True,1.0,needs_review_low_sim,"[""share_buyback"", ""equity_actions_non_buyback"", ""agm_egm_governance""]","[0.0592, 0.0566, 0.0528]"
198bea926f282c76,2025-08-18,Nordea Bank Oyj,unknown,gmail,,share_buyback,Share buyback,0.059,0.0026,needs_review_low_sim,Omien osakkeiden takaisinosto 18.08.2025,"Omien osakkeiden takaisinosto 18.08.2025 Julkaistu: 2025-08-18 21:30:00 CEST COMPANY - Muutokset omien osakkeiden omistuksessa COMPANY: Omien osakkeiden takaisinosto 18.08.2025 COMPANY Pörssitiedote - Muutokset omien osakkeiden omistuksessa 18.08.2025 klo 22.30 Suomen aikaa COMPANY (LEI: 529900ODI3047E2LIV03) on 18.08.2025 hankkinut omia osakkeitaan (ISIN: FI4000297767) omistukseensa seuraavasti: Markkinapaikka (MIC-koodi) Osakkeiden lukumäärä Painotettu keskihinta osakkeelta, euroa* ** Kulut yhteensä, euroa * ** XHEL 133 573 13,57 1 813 026,40 XSTO 120 045 13,56 1 627 955,57 XCSE 13 141 13,57",2025-09-02T130606Z,v3,0.0548,0.0654,2.9443,2.9422,2.9438,0.1682,True,share_buyback,0.059,0.0026,2.9438,g00000455,1,True,1.0,needs_review_low_sim,"[""share_buyback"", ""equity_actions_non_buyback"", ""agm_egm_governance""]","[0.059, 0.0565, 0.0527]"
1977a39ee890fcb1,2025-06-16,Addtech,unknown,gmail,,other_corporate_update,Other / Corporate update,0.0533,0.0002,needs_review_low_sim,Welcome,"[*] Thank you for subscribing to information from COMPANY. From now on, you will receive information from COMPANY to this e-mail address. If you wish to unsubscribe, please click on the link below. (if you cannot click it, copy it and paste it into a Web browser) Best regards, COMPANY",2025-09-02T130606Z,v3,0.0537,0.0526,2.9444,2.9444,2.9444,0.1593,False,other_corporate_update,0.0533,0.0002,2.9444,g00000456,1,True,1.0,needs_review_low_sim,"[""other_corporate_update"", ""admission_delisting"", ""dividend""]","[0.0533, 0.0531, 0.053]"
19789b912027604e,2025-06-19,Google Cloud,unknown,gmail,,credit_ratings,Credit & Ratings,0.0543,0.0011,needs_review_low_sim,Account confirmation: Your COMPANY Platform trial,"COMPANY Go to my console Welcome to COMPANY. Learn the fundamentals with this tutorial - and see what else you can do on GCP with our Always Free tier. Go to my console Beginning today, you have $300 USD in credit which you can use to: - Evaluate COMPANY risk-free* - Explore a wide range of COMPANY products and services - from Compute Engine and BigQuery to industry-leading AI. - Easily check your credit usage by visiting the billing section of your COMPANY console See what's always free. Before diving into your free trial, take a moment to explore over 20 always-free products in our Always Fr",2025-09-02T130606Z,v3,0.0536,0.0569,2.9444,2.9442,2.9444,0.1605,False,credit_ratings,0.0543,0.0011,2.9444,g00000457,1,True,1.0,needs_review_low_sim,"[""credit_ratings"", ""dividend"", ""capital_raise_rights_issue""]","[0.0543, 0.0531, 0.053]"
19807cb05f2ab32f,2025-07-14,Dometic Group (STO),unknown,gmail,,earnings_report,Earnings report,0.0552,0.0015,needs_review_low_sim,Financial calendar event reminder,"Financial calendar event reminder Dear Subscriber, You asked to be notified of our upcoming events. Please see the details of the upcoming event that matches your interest criteria below: Event: Interim Report for the second quarter 2025 Date and time: 15/07/2025 at 07:30 (UTC+02:00) Event type: Financial Results You can see all the upcoming events here. Best regards, COMPANY The service was requested through the COMPANY website. To modify your subscription, please subscribe again. If you no longer wish to receive these emails, you may unsubscribe at any time. Supplied © Euroland.com - Privacy",2025-09-02T130606Z,v3,0.0541,0.0567,2.9443,2.9442,2.9443,0.1624,True,earnings_report,0.0552,0.0015,2.9443,g00000458,1,True,1.0,needs_review_low_sim,"[""earnings_report"", ""capital_raise_rights_issue"", ""dividend""]","[0.0552, 0.0537, 0.0536]"
198cb5a5422dfc3c,2025-08-21,Sectra,unknown,gmail,,earnings_report,Earnings report,0.0534,0.0004,needs_review_low_sim,Welcome,"[*] Dear subscriber, From now on, you will receive press releases, financial reports and other investor related information from COMPANY to this e-mail address. You may change your preferences or opt-out at any time using the unsubscribe link provided in COMPANY's email communications. Kind regards, The COMPANY team To unsubscribe, please use the link below (if you can't click on the link, copy the link and paste it into your browser). Cancel subscription",2025-09-02T130606Z,v3,0.0534,0.0547,2.9444,2.9444,2.9444,0.1595,False,earnings_report,0.0534,0.0004,2.9444,g00000459,1,True,1.0,needs_review_low_sim,"[""earnings_report"", ""other_corporate_update"", ""equity_actions_non_buyback""]","[0.0534, 0.053, 0.053]"
198a7dcf95cb35c1,2025-08-14,NKT A/S,unknown,gmail,,admission_delisting,Delisting / Trading halt,0.0533,0.0001,needs_review_low_sim,Subscription details,"Dear Subscriber, You are subscribed to the following notification services: Stock Exchange Releases The service was requested through COMPANY. To modify your subscription, please subscribe again. If you no longer wish to receive these emails, you may unsubscribe at any time. Supplied © Euroland.com - Privacy Policy",2025-09-02T130606Z,v3,0.0539,0.0549,2.9444,2.9444,2.9444,0.1597,False,admission_delisting,0.0533,0.0001,2.9444,g00000460,1,True,1.0,needs_review_low_sim,"[""admission_delisting"", ""incidents_controversies"", ""dividend""]","[0.0533, 0.0532, 0.0532]"
198c6562daefa4c7,2025-08-20,Dometic Group (STO),unknown,gmail,,capital_raise_rights_issue,Capital raise / Rights issue,0.0541,0.0004,needs_review_low_sim,Financial calendar event reminder,"Financial calendar event reminder Dear Subscriber, You asked to be notified of our upcoming events. Please see the details of the upcoming event that matches your interest criteria below: Event: Nordea Equities Small & Mid Cap Days Date and time: 21/08/2025 Event type: Conferences & Roadshows Location: STockholm You can see all the upcoming events here. Best regards, COMPANY The service was requested through the COMPANY website. To modify your subscription, please subscribe again. If you no longer wish to receive these emails, you may unsubscribe at any time. Supplied © Euroland.com - Privacy ",2025-09-02T130606Z,v3,0.0542,0.0542,2.9443,2.9444,2.9444,0.1613,False,capital_raise_rights_issue,0.0541,0.0004,2.9444,g00000462,1,True,1.0,needs_review_low_sim,"[""capital_raise_rights_issue"", ""dividend"", ""admission_listing""]","[0.0541, 0.0538, 0.0533]"
198a9516660d75cd,2025-08-14,Nova Klúbburinn hf.,unknown,gmail,,earnings_report,Earnings report,0.0536,0.0003,needs_review_low_sim,COMPANY Klúbburinn hf. birtir uppgjör annars ársfjórðungs 2025,"COMPANY Klúbburinn hf. birtir uppgjör annars ársfjórðungs 2025 Published: 2025-08-14 18:02:04 CEST COMPANY Klúbburinn hf. - Árshlutareikningur - 6 mán. COMPANY Klúbburinn hf. birtir uppgjör annars ársfjórðungs 2025 Áfram stöðugur vöxtur hjá COMPANY Rekstur COMPANY skilaði góðri afkomu á öðrum ársfjórðungi ársins. Heildartekjur voru um 3,4 milljarðar og jukust um 6,2% milli ára. Þjónustutekjur hækkuðu um 7,9% og EBITDA jókst um 9,7%. Hagnaður fjórðungsins var 149 milljónir og eykst um 38,2% milli ára. Helstu niðurstöður á öðrum ársfjórðungi: Heildartekjur voru 3.428 m.kr. og vaxa um 6,2% á mill",2025-09-02T130606Z,v3,0.0543,0.0526,2.9443,2.9444,2.9444,0.1601,True,earnings_report,0.0536,0.0003,2.9444,g00000463,1,True,1.0,needs_review_low_sim,"[""earnings_report"", ""equity_actions_non_buyback"", ""capital_raise_rights_issue""]","[0.0536, 0.0533, 0.0531]"
198f1bbf2aed0c9a,2025-08-28,Nasdaq Company News,unknown,gmail,,capital_raise_rights_issue,Capital raise / Rights issue,0.0534,0.0001,needs_review_low_sim,Félagsbústaðir hf.: Árshlutareikningur 30.06.2025,"Félagsbústaðir hf.: Árshlutareikningur 30.06.2025 Published: 2025-08-28 19:31:13 CEST Félagsbústaðir hf. - Árshlutareikningur - 6 mán. Félagsbústaðir hf.: Árshlutareikningur 30.06.2025 Árshlutareikningur Félagsbústaða 30.06.2025 Stjórn Félagsbústaða hf. samþykkti árshlutareikning félagsins fyrir fyrstu 6 mánuði ársins 2025 á fundi sínum í dag 28. ágúst. Hagnaður vegna hækkunar á eignasafni Hagnaður félagsins á tímabilinu nam 6.534 m.kr., sem skýrist að mestu af matsbreytingu fjárfestingareigna. Hagnaðurinn verður ekki innleystur nema með eignasölu. Sjóðstreymi Félagsbústaða sýnir að handbært f",2025-09-02T130606Z,v3,0.0539,0.0526,2.9443,2.9444,2.9444,0.1598,False,capital_raise_rights_issue,0.0534,0.0001,2.9444,g00000057,1,True,1.0,needs_review_low_sim,"[""capital_raise_rights_issue"", ""equity_actions_non_buyback"", ""earnings_report""]","[0.0534, 0.0533, 0.0531]"
198f16c8883387ac,2025-08-28,Hampiðjan hf.,unknown,gmail,,earnings_report,Earnings report,0.0536,0.0003,needs_review_low_sim,COMPANY - sex mánaða árshlutareikningur samstæðu Hampiðjunnar 2025,"COMPANY - sex mánaða árshlutareikningur samstæðu Hampiðjunnar 2025 Published: 2025-08-28 18:04:28 CEST COMPANY- Árshlutareikningur - 6 mán. COMPANY - sex mánaða árshlutareikningur samstæðu Hampiðjunnar 2025 Lykilstærðir Allar fjárhæðir í evrum og samanburðartölur í sviga. Rekstrartekjur voru 184,8 m€ (158,2 m€). EBITDA af reglulegri starfsemi á ársfjórðungnum var 24,2 m€ (19,7 m€). EBITDA leiðrétt fyrir einskiptiskostnaði vegna kaupa á Kohinoor nam 24,7 m€. Hagnaður af áframhaldandi starfsemi tímabilsins nam 7,0 m€ (7,7 m€). Heildareignir voru 539,6 m€ (509,5 m€ í lok 2024). Vaxtaberandi skuld",2025-09-02T130606Z,v3,0.0542,0.0526,2.9443,2.9444,2.9444,0.16,True,earnings_report,0.0536,0.0003,2.9444,g00000464,1,True,1.0,needs_review_low_sim,"[""earnings_report"", ""equity_actions_non_buyback"", ""capital_raise_rights_issue""]","[0.0536, 0.0533, 0.0531]"
198cd641bd130e21,2025-08-21,RARIK ohf.,unknown,gmail,,capital_raise_rights_issue,Capital raise / Rights issue,0.0534,0.0,needs_review_low_sim,Árshlutauppgjör COMPANY,"Árshlutauppgjör COMPANY Published: 2025-08-21 18:08:57 CEST COMPANY- Árshlutareikningur - 6 mán. Árshlutauppgjör COMPANY Hagnaður COMPANY var 1,5 milljarðar króna. Félagið sýnir sterka rekstrarniðurstöðu á fyrri hluta ársins með verulegum tekju- og afkomuvexti, auknu handbæru fé og traustum efnahag. Helstu lykiltölur (í millj. kr.) Lykiltala 1.1-30.6 2025 1.1-30.6 2024 Rekstrartekjur 14.095 11.778 EBITDA 4.834 3.283 Rekstrarhagnaður (EBIT) 2.937 1.571 Hagnaður eftir skatta 1.494 690 Handbært fé frá rekstri 3.694 2.364 Fjárfestingar 3.513 3.131 Eiginfjárhlutfall 63,30% 62,90% Hagnaður COMPANY s",2025-09-02T130606Z,v3,0.0538,0.0526,2.9444,2.9444,2.9444,0.1598,False,capital_raise_rights_issue,0.0534,0.0,2.9444,g00000465,1,True,1.0,needs_review_low_sim,"[""capital_raise_rights_issue"", ""equity_actions_non_buyback"", ""earnings_report""]","[0.0534, 0.0533, 0.0531]"
198d15dfc878257e,2025-08-22,Ljósleiðarinn ehf.,unknown,gmail,,equity_actions_non_buyback,Equity actions (non-buyback),0.0533,0.0001,needs_review_low_sim,Rekstrarafkoma Ljósleiðarans batnar,"Rekstrarafkoma Ljósleiðarans batnar Published: 2025-08-22 12:40:50 CEST Ljósleiðarinn ehf. - Reikningsskil Rekstrarafkoma Ljósleiðarans batnar Afkoma Ljósleiðarans á fyrstu sex mánuðum ársins var talsvert betri en á sama tíma í fyrra. Tap varð þó af rekstrinum sem nam 328,5 mkr. en var 480,2 mkr. á fyrri helmingi síðasta árs. Fyrirtækið, sem er alfarið í íslenskri eigu Orkuveitunnar, er að rétta reksturinn af eftir mikið fjárfestingaskeið sem skilað hefur tugþúsundum heimila og þúsundum fyrirtækja bestu fáanlegu nettengingum. Tekjur jukust um 6,8% á milli ára og námu 2.958 mkr. á fyrri hluta y",2025-09-02T130606Z,v3,0.0537,0.0526,2.9444,2.9444,2.9444,0.1595,False,equity_actions_non_buyback,0.0533,0.0001,2.9444,g00000466,1,True,1.0,needs_review_low_sim,"[""equity_actions_non_buyback"", ""earnings_report"", ""capital_raise_rights_issue""]","[0.0533, 0.0532, 0.0531]"
198cd780a0ea7c0b,2025-08-21,Sýn hf.,unknown,gmail,,capital_raise_rights_issue,Capital raise / Rights issue,0.0532,0.0002,needs_review_low_sim,Sýn hf.: Nova hf. og Sýn hf. undirrita samkomulag um Sendafélag,"Sýn hf.: Nova hf. og Sýn hf. undirrita samkomulag um Sendafélag Published: 2025-08-21 18:30:45 CEST Sýn hf. - Innherjaupplýsingar Sýn hf.: Nova hf. og Sýn hf. undirrita samkomulag um Sendafélag Nova hf., kt. 531205-0810, og Sýn hf., kt. 470905-1740, hafa í dag undirritað samkomulag um helstu atriði fyrirhugaðra samninga um framsal farnetsdreifikerfa Nova hf. og Sýnar hf. til Sendafélagsins ehf., kt. 440515-1850. Nova hf. og Sýn hf. eru einu hluthafarnir, í jöfnum hlutföllum, í Sendafélaginu ehf., sem var stofnað árið 2015. Sendafélagið ehf. hefur það hlutverk að reka dreifikerfi („RAN"" kerfi, ",2025-09-02T130606Z,v3,0.0536,0.0526,2.9444,2.9444,2.9444,0.1593,False,capital_raise_rights_issue,0.0532,0.0002,2.9444,g00000467,1,True,1.0,needs_review_low_sim,"[""capital_raise_rights_issue"", ""equity_actions_non_buyback"", ""orders_contracts""]","[0.0532, 0.0531, 0.053]"
198a44eda6fdf4db,2025-08-13,H. Lundbeck A/S,unknown,gmail,,debt_bond_issue,Debt / Bond issue,0.0551,0.0019,needs_review_low_sim,Guidance raised based on solid H1 results and continued strong expectations for the full year 2025,"[*] Guidance raised based on solid H1 results and continued strong expectations for the full year 2025 Key highlights Lundbeck's total revenue grew by +14% CER[1] (+14% DKK) to DKK 12,258 million in the first six months of 2025. Growth in the U.S. and Europe was the driver of this strong performance. * United States: DKK 6,524 million (+22% CER; +23% DKK) * Europe: DKK 2,868 million (+14% CER; +14% DKK) * International Operations: DKK 2,724 million (+0% CER; -3% DKK) The revenue of Lundbeck's strategic brands increased by +21% CER (+21% DKK), reaching DKK 9,436 million, representing 77% of tot",2025-09-02T130606Z,v3,0.0537,0.0571,2.9444,2.9442,2.9444,0.1612,True,earnings_report,0.0551,0.0019,2.9444,g00000468,1,True,1.0,needs_review_low_sim,"[""earnings_report"", ""orders_contracts"", ""share_buyback""]","[0.0551, 0.0531, 0.053]"
198ef2f5c4586eae,2025-08-28,Per Aarsleff Holding A/S,unknown,gmail,,earnings_report,Earnings report,0.0569,0.0029,needs_review_low_sim,Interim financial report for the period 1 October 2024-30 June 2025,"Interim financial report for the period 1 October 2024-30 June 2025 Published: 2025-08-28 07:38:29 CEST COMPANY - Interim report (Q1 and Q3) Interim financial report for the period 1 October 2024-30 June 2025 28.8.2025 07:38:29 CEST | COMPANY | Interim report (Q1 and Q3) Today, the Board of Directors of COMPANY has discussed and approved the interim financial report for the first nine months of 2024/25. The interim financial report has not been audited or reviewed by the company's auditors. Highlights Revenue during the first nine months of the financial year was in line with expectations, and",2025-09-02T130606Z,v3,0.0549,0.06,2.9444,2.9438,2.9442,0.1639,True,earnings_report,0.0569,0.0029,2.9442,g00000469,1,True,1.0,needs_review_low_sim,"[""earnings_report"", ""personnel_management_change"", ""orders_contracts""]","[0.0569, 0.054, 0.053]"
198ea3a0d4f37e35,2025-08-27,Shape Robotics A/S,unknown,gmail,,orders_contracts,Orders / Contracts,0.0576,0.0033,needs_review_low_sim,COMPANY Robotics Reports Half-Year Results with Double-Digit Million Profit,"COMPANY Robotics Reports Half-Year Results with Double-Digit Million Profit Published: 2025-08-27 08:32:00 CEST COMPANY - Investor News COMPANY Robotics Reports Half-Year Results with Double-Digit Million Profit COMPANY Robotics today announces its half-year financial results for 2025 looking back on the past 12 months (LTM) with record-high revenue, record-high EBITDA, and a positive net result of DKK 13.5 million. The combination of strengthened margins, long-term financing, new partnerships, and the rapid integration of the Finnish company Sanako has, over the past year, established COMPANY",2025-09-02T130606Z,v3,0.0538,0.0632,2.9444,2.9432,2.9441,0.1649,True,earnings_report,0.0576,0.0033,2.9441,g00000470,1,True,1.0,needs_review_low_sim,"[""earnings_report"", ""orders_contracts"", ""dividend""]","[0.0576, 0.0543, 0.0529]"
198a8ad215d3875d,2025-08-14,Gabriel Holding A/S,unknown,gmail,,earnings_report,Earnings report,0.0555,0.0026,needs_review_low_sim,COMPANY upwardly adjusts its expectations for the financial year 2024/25 for the continuing operations,"COMPANY upwardly adjusts its expectations for the financial year 2024/25 for the continuing operations Published: 2025-08-14 15:02:53 CEST COMPANY - Inside information COMPANY upwardly adjusts its expectations for the financial year 2024/25 for the continuing operations The quarterly report for Q3 will be published as planned on August 28, 2025. It will show that the continuing operations after 9 months have achieved a revenue of DKK 390.1 million, corresponding to a growth of 7%. The primary result (EBIT) was DKK 31.7 million compared to DKK 11.9 million in the same period last year. The Grou",2025-09-02T130606Z,v3,0.0545,0.057,2.9444,2.9442,2.9443,0.1614,True,earnings_report,0.0555,0.0026,2.9443,g00000472,1,True,1.0,needs_review_low_sim,"[""earnings_report"", ""personnel_management_change"", ""orders_contracts""]","[0.0555, 0.053, 0.0529]"
198c0eb375563191,2025-08-19,MT Højgaard Holding A/S,unknown,gmail,,orders_contracts,Orders / Contracts,0.057,0.0016,needs_review_low_sim,Consolidation and strengthening of order portfolio in Q2,"Consolidation and strengthening of order portfolio in Q2 Published: 2025-08-19 08:00:26 CEST COMPANY - Half Year financial report COMPANY: Consolidation and strengthening of order portfolio in Q2 SECOND-QUARTER RESULTS (Comparative figures for the second quarter of 2024 are shown in brackets) The second quarter was characterised by high production and a significant intake of new orders. Revenue and operating profit developed in line with the full-year expectations, and profit after tax improved following the winding-up of loss-making international activities. Revenue amounted to DKK 2,675 mill",2025-09-02T130606Z,v3,0.054,0.0622,2.9444,2.9431,2.9441,0.1662,False,orders_contracts,0.057,0.0016,2.9441,g00000473,1,True,1.0,needs_review_low_sim,"[""orders_contracts"", ""earnings_report"", ""product_launch_partnership""]","[0.057, 0.0554, 0.0538]"
198c30c383180130,2025-08-19,TCM Group A/S,unknown,gmail,,earnings_report,Earnings report,0.0569,0.0036,needs_review_low_sim,Interim report Q2 2025,"Interim report Q2 2025 Published: 2025-08-19 17:56:52 CEST COMPANY - Half Year financial report COMPANY: Interim report Q2 2025 COMPANY ANNOUNCEMENT No. 234/2025 Tvis, 19 August 2025 Interim report Q2 2025 (April 1 - June 30) (All figures in brackets refer to the corresponding period in 2024) Improved earnings and steady sales growth, delivered in a challenging market. CEO Torben Paulin: ""Sales in the second quarter developed broadly in line with our expectations, with growth in both the B2B and B2C segments, following the solid order intake in the first quarter of 2025. Total sales for the qu",2025-09-02T130606Z,v3,0.0544,0.0607,2.9444,2.9437,2.9442,0.1633,True,earnings_report,0.0569,0.0036,2.9442,g00000474,1,True,1.0,needs_review_low_sim,"[""earnings_report"", ""personnel_management_change"", ""orders_contracts""]","[0.0569, 0.0533, 0.0532]"
198ef43293c8ee2e,2025-08-28,Instalco AB,unknown,gmail,,orders_contracts,Orders / Contracts,0.0548,0.0008,needs_review_low_sim,COMPANY wins contract for installations at new building for the Swedish Prison and Probation Service,"COMPANY wins contract for installations at new building for the Swedish Prison and Probation Service Published: 2025-08-28 08:00:00 CEST COMPANY - Investor News COMPANY wins contract for installations at new building for the Swedish Prison and Probation Service Five COMPANY subsidiaries have won a joint assignment for the design and installation of the ventilation, heating & plumbing, sprinkler and automation systems at the new building that is being constructed for the Swedish Prison and Probation Service in Västerås. The order value for COMPANY is SEK 260 million. The COMPANY subsidiaries - ",2025-09-02T130606Z,v3,0.0538,0.0561,2.9444,2.9442,2.9444,0.1617,True,orders_contracts,0.0548,0.0008,2.9444,g00000475,1,True,1.0,needs_review_low_sim,"[""orders_contracts"", ""product_launch_partnership"", ""legal_regulatory_compliance""]","[0.0548, 0.054, 0.053]"
19905418bcf68d3b,2025-09-01,Logistea AB,unknown,gmail,,orders_contracts,Orders / Contracts,0.0536,0.0007,needs_review_low_sim,COMPANY has today closed the acquisition of two properties in Ulricehamn and Tranemo fully let to AP&T with an underlying property value of SEK 226 million,"COMPANY has today closed the acquisition of two properties in Ulricehamn and Tranemo fully let to AP&T with an underlying property value of SEK 226 million Published: 2025-09-01 14:30:00 CEST COMPANY - Investor News COMPANY has today closed the acquisition of two properties in Ulricehamn and Tranemo fully let to AP&T with an underlying property value of SEK 226 million COMPANY (publ) has today closed the acquisition of the properties Rönnebacken 1 in Ulricehamn and Ömmestorp 1:27 in Tranemo. The properties have an agreed underlying property value of SEK 226 million, before a deduction for defe",2025-09-02T130606Z,v3,0.0534,0.0539,2.9444,2.9444,2.9444,0.1595,True,orders_contracts,0.0536,0.0007,2.9444,g00000476,1,True,1.0,needs_review_low_sim,"[""orders_contracts"", ""pdmr_managers_transactions"", ""share_buyback""]","[0.0536, 0.053, 0.0529]"
