press_release_id,release_date,company_name,category,source,source_url,cid,category_name,cat_sim,cat_margin,decision,title,snippet,run_id,taxonomy_version,p1_emb,p1_lsa,entropy_emb,entropy_lsa,entropy_fused,top3_fused_sum,agreement_emb_lsa,cid_group,cat_sim_group,cat_margin_group,entropy_fused_group,dup_group_id,dup_group_size,is_group_rep,sample_weight_dedup,decision_group,top3_cids,top3_probs
198f7bf11dc1a9c5,2025-08-29,ALK,unknown,gmail,,admission_listing,Admission / Listing,0.0534,0.0001,needs_review_low_sim,Weekly Summary Alert for COMPANY,"COMPANY added the following items during the week of August 25, 2025 ALKB Monday Tuesday Wednesday Thursday Friday Opening Price 208.40 204.00 200.80 199.20 199.60 Last Trade 203.40 201.80 199.40 200.20 201.20 Price Change -5.60 -1.60 -2.40 +0.80 +1.00 Percent Change -2.68% -0.79% -1.19% +0.40% +0.50% Day High 210.20 204.00 201.00 202.20 202.80 Day Low 202.60 201.20 196.50 196.70 198.30 Volume 214,934 203,959 218,284 240,158 218,944 Visit the website → You are subscribed to COMPANY Investor Relations' email alerts. To unsubscribe from all alerts, please click here. COMPANY Bøge Allé 6-8 DK-297",2025-09-02T130606Z,v3,0.0538,0.0536,2.9444,2.9444,2.9444,0.16,False,admission_listing,0.0534,0.0001,2.9444,g00000320,1,True,1.0,needs_review_low_sim,"[""admission_listing"", ""admission_delisting"", ""dividend""]","[0.0534, 0.0533, 0.0533]"
197d75cb92e07e2a,2025-07-04,ALK,unknown,gmail,,admission_listing,Admission / Listing,0.0533,0.0,needs_review_low_sim,Weekly Summary Alert for COMPANY,"COMPANY added the following items during the week of June 30, 2025 ALKB Monday Tuesday Wednesday Thursday Friday Opening Price 186.30 187.90 188.00 185.90 186.50 Last Trade 186.90 187.80 185.90 186.50 189.80 Price Change +1.60 +0.90 -1.90 +0.60 +3.30 Percent Change +0.86% +0.48% -1.01% +0.32% +1.77% Day High 188.50 188.70 188.00 188.10 190.00 Day Low 185.60 186.20 183.60 185.90 185.50 Volume 149,078 143,110 208,023 79,181 291,121 Visit the website → You are subscribed to COMPANY Investor Relations' email alerts. To unsubscribe from all alerts, please click here. COMPANY Bøge Allé 6-8 DK-2970, ",2025-09-02T130606Z,v3,0.0539,0.0535,2.9444,2.9444,2.9444,0.1599,False,admission_listing,0.0533,0.0,2.9444,g00000321,1,True,1.0,needs_review_low_sim,"[""admission_listing"", ""admission_delisting"", ""dividend""]","[0.0533, 0.0533, 0.0533]"
197b34f11f5f16d1,2025-06-27,ALK,unknown,gmail,,admission_listing,Admission / Listing,0.0536,0.0002,needs_review_low_sim,Weekly Summary Alert for COMPANY,"COMPANY added the following items during the week of June 23, 2025 All Releases First market launch of the adrenaline nasal spray, EURneffy®, for treatment of adults and children in Germany ALKB Monday Tuesday Wednesday Thursday Friday Opening Price 178.50 184.40 183.90 182.30 184.90 Last Trade 183.50 184.30 182.70 184.90 185.30 Price Change +2.50 +0.80 -1.60 +2.20 +0.40 Percent Change +1.38% +0.44% -0.87% +1.20% +0.22% Day High 183.90 186.50 185.50 186.00 186.70 Day Low 178.50 183.60 182.10 182.30 184.40 Volume 122,951 128,304 114,462 123,449 97,001 Visit the website → You are subscribed to C",2025-09-02T130606Z,v3,0.0538,0.0538,2.9444,2.9444,2.9444,0.1602,False,admission_listing,0.0536,0.0002,2.9444,g00000322,1,True,1.0,needs_review_low_sim,"[""admission_listing"", ""product_launch_partnership"", ""admission_delisting""]","[0.0536, 0.0533, 0.0532]"
198ad867cab082db,2025-08-15,SP Group A/S,unknown,gmail,,share_buyback,Share buyback,0.0571,0.0024,needs_review_low_sim,Share buy-back program at COMPANY,"Share buy-back program at COMPANY Published: 2025-08-15 13:38:47 CEST COMPANY - Changes in company's own shares Share buy-back program at COMPANY COMPANY Announcement No. 34 /2025 15 August 2025 CVR No. 15701315 Share buy-back program at COMPANY On 24 April 2025, COMPANY Group initiated a share buy-back programme, cf. company announcement no. 18/2025 of 24 April 2025. According to the programme, COMPANY Group will in the period from 28 April 2025 until 31 December 2025, both days inclusive, purchase own shares for a maximum amount of DKK 40.0 million. The share buy-back programme was initiated",2025-09-02T130606Z,v3,0.0571,0.0572,2.9441,2.9442,2.9441,0.1653,True,share_buyback,0.0571,0.0024,2.9441,g00000323,1,True,1.0,needs_review_low_sim,"[""share_buyback"", ""equity_actions_non_buyback"", ""pdmr_managers_transactions""]","[0.0571, 0.0548, 0.0534]"
198e0438dbd8b354,2025-08-25,ISS A/S,unknown,gmail,,share_buyback,Share buyback,0.0575,0.0017,needs_review_low_sim,Transactions in connection with share buyback programme,"Transactions in connection with share buyback programme Published: 2025-08-25 10:06:12 CEST COMPANY - Changes in company's own shares Transactions in connection with share buyback programme Company Announcement Copenhagen, 25 August 2025 No. 50/2025 COMPANY, a leading workplace experience and facility management company, announced on 20 February 2025 a new share buyback programme, see company announcement no. 12/2025. The share buyback programme is executed in accordance Regulation (EU) No 596/2014 of the European Parliament and of the Council of 16 April 2014 (the ""Market Abuse Regulation"") a",2025-09-02T130606Z,v3,0.0565,0.059,2.9442,2.9438,2.9441,0.1664,True,share_buyback,0.0575,0.0017,2.9441,g00000324,1,True,1.0,needs_review_low_sim,"[""share_buyback"", ""equity_actions_non_buyback"", ""pdmr_managers_transactions""]","[0.0575, 0.0557, 0.0532]"
198d1a819527bdad,2025-08-22,SP Group A/S,unknown,gmail,,share_buyback,Share buyback,0.0569,0.002,needs_review_low_sim,Share buy-back program at COMPANY,"Share buy-back program at COMPANY Published: 2025-08-22 14:01:47 CEST COMPANY - Changes in company's own shares Share buy-back program at COMPANY COMPANY Announcement No. 40 /2025 22 August 2025 CVR No. 15701315 Share buy-back program at COMPANY On 24 April 2025, COMPANY Group initiated a share buy-back programme, cf. company announcement no. 18/2025 of 24 April 2025. The share buy-back programme was increased cf. company announcement no. 35/2025 of 19 August 2025 with DKK 40.0 million. According to the programme, COMPANY Group will in the period from 28 April 2025 until 10 April 2026, both da",2025-09-02T130606Z,v3,0.0569,0.0567,2.9441,2.9442,2.9442,0.1651,True,share_buyback,0.0569,0.002,2.9442,g00000325,1,True,1.0,needs_review_low_sim,"[""share_buyback"", ""equity_actions_non_buyback"", ""pdmr_managers_transactions""]","[0.0569, 0.0548, 0.0535]"
198bd4af69fa7073,2025-08-18,Pandora A/S,unknown,gmail,,share_buyback,Share buyback,0.0575,0.0019,needs_review_low_sim,Transactions in connection with share buyback programme,"Transactions in connection with share buyback programme Published: 2025-08-18 15:07:38 CEST COMPANY - Changes in company's own shares Transactions in connection with share buyback programme On 5 February 2025, COMPANY announced a new share buyback programme, cf. Company announcement no. 923. The share buyback programme is executed in accordance with Regulation (EU) No 596/2014 of the European Parliament and of the Council of 16 April 2014 on market abuse (market abuse regulation). The purpose of the programme is to reduce COMPANY's share capital and to meet obligations arising from company inc",2025-09-02T130606Z,v3,0.0565,0.0591,2.9442,2.9438,2.9441,0.1664,True,share_buyback,0.0575,0.0019,2.9441,g00000326,1,True,1.0,needs_review_low_sim,"[""share_buyback"", ""equity_actions_non_buyback"", ""pdmr_managers_transactions""]","[0.0575, 0.0556, 0.0533]"
198ea01fe7ab1479,2025-08-27,FLSmidth,unknown,gmail,,share_buyback,Share buyback,0.0552,0.0008,needs_review_low_sim,Transactions under share buy-back programme,"COMPANY ANNOUNCEMENT NO. 25-2025 COMPANY & Co. A/S 27 August 2025 Copenhagen, Denmark On 25 June 2025, COMPANY & Co. A/S (COMPANY) initiated a share buy-back programme of up to DKK 1.4 billion (ref. Company Announcement no. 12-2025). Under the share buy-back programme, COMPANY may repurchase shares up to a maximum amount of DKK 1.4 billion, and no more than 4,600,000 shares, corresponding to approximately 8 percent of the share capital of the company. The share buy-back programme will be executed in accordance with Article 5 of Regulation (EU) No. 596/2014 of the European Parliament and of the",2025-09-02T130606Z,v3,0.056,0.0542,2.9442,2.9444,2.9443,0.1628,False,share_buyback,0.0552,0.0008,2.9443,g00000327,1,True,1.0,needs_review_low_sim,"[""share_buyback"", ""equity_actions_non_buyback"", ""pdmr_managers_transactions""]","[0.0552, 0.0544, 0.0532]"
198bc675217638e4,2025-08-18,Matas A/S,unknown,gmail,,share_buyback,Share buyback,0.0549,0.0003,needs_review_low_sim,COMPANY share buy-back programme: Reporting of transactions in week 33,"COMPANY share buy-back programme: Reporting of transactions in week 33 Published: 2025-08-18 10:59:00 CEST COMPANY - Changes in company's own shares COMPANY share buy-back programme: Reporting of transactions in week 33 Company announcement no. 18 2025/26 Allerød, 18 August 2025 On 16 June 2025, COMPANY announced a share buy-back programme of up to DKK 140 million (the ""Programme""), with a maximum of 1.4 million shares, in the period from 17 June 2025 until and including 31 March 2026 at the latest. The Programme is described in Company Announcement no. 06 2025/26. The purpose of the Programme",2025-09-02T130606Z,v3,0.0552,0.0549,2.9443,2.9443,2.9443,0.163,False,share_buyback,0.0549,0.0003,2.9443,g00000328,1,True,1.0,needs_review_low_sim,"[""share_buyback"", ""equity_actions_non_buyback"", ""pdmr_managers_transactions""]","[0.0549, 0.0546, 0.0535]"
198f68ef2727715c,2025-08-29,RightBridge Ventures Group AB,unknown,gmail,,personnel_management_change,Personnel / Management change,0.0554,0.0001,needs_review_low_sim,COMPANY HALF‑YEAR REPORT H1 2025,"COMPANY HALF‑YEAR REPORT H1 2025 Published: 2025-08-29 18:00:00 CEST COMPANY - Half year financial report COMPANY HALF‑YEAR REPORT H1 2025 Financial summary - first half year 2025: Company income statement (summary) jan-jun year TKR 2025 2024 2024 Revenue 0 0 100 EBITDA -1 094 -1 839 -5 063 Depreciation and impairment -1 514 -1 500 -57 829 EBIT -2 608 -3 339 -62 892 Result for the period -3 536 -3 944 -66 024 Result per share -0,004 -0,005 -0,08 COMPANY has, in the first half of 2025, disposed of and/or liquidated all investments, including subsidiaries, as part of a restructuring of the compa",2025-09-02T130606Z,v3,0.0552,0.0594,2.9443,2.9437,2.9442,0.1643,False,agm_egm_governance,0.0554,0.0001,2.9442,g00000329,1,True,1.0,needs_review_low_sim,"[""agm_egm_governance"", ""earnings_report"", ""equity_actions_non_buyback""]","[0.0554, 0.0553, 0.0536]"
198e67630eb4f761,2025-08-26,Alm. Brand A/S,unknown,gmail,,capital_raise_rights_issue,Capital raise / Rights issue,0.0536,0.0004,needs_review_low_sim,Danish FSA approves the application for an expansion of COMPANY' Partial Internal Model,Danish FSA approves the application for an expansion of COMPANY' Partial Internal Model Published: 2025-08-26 14:59:14 CEST COMPANY - Investor News Danish FSA approves the application for an expansion of COMPANY' Partial Internal Model The approval of the Partial Internal Model is expected to reduce the solvency capital requirement for COMPANY with about DKK 0.6 billion Today the Danish FSA has approved the application for the use of the Partial Internal Model (PIM) for COMPANY' total insurance activities. The Partial Internal Model is a group-wide internal model. The expansion includes the in,2025-09-02T130606Z,v3,0.0536,0.0543,2.9444,2.9444,2.9444,0.1598,False,capital_raise_rights_issue,0.0536,0.0004,2.9444,g00000330,1,True,1.0,needs_review_low_sim,"[""capital_raise_rights_issue"", ""dividend"", ""equity_actions_non_buyback""]","[0.0536, 0.0532, 0.0531]"
198e4f68d1075b7b,2025-08-26,Isofol Medical AB,unknown,gmail,,debt_bond_issue,Debt / Bond issue,0.0559,0.0008,needs_review_low_sim,"COMPANY (publ) publishes interim report, January-June 2025","COMPANY (publ) publishes interim report, January-June 2025 Published: 2025-08-26 08:00:00 CEST COMPANY - Half Year financial report COMPANY (publ) publishes interim report, January-June 2025 GOTHENBURG, Sweden, August 26, 2025 - COMPANY (publ), (Nasdaq Stockholm: COMPANY), announced today that the company's interim report for January-June 2025 is now available, in Swedish, on the company's website, The information in the press release is intended for investors. CEO's comment ""With a strengthened financial position, we can now fully focus on what is central - driving clinical development forwar",2025-09-02T130606Z,v3,0.0552,0.0581,2.9443,2.9439,2.9442,0.1641,False,earnings_report,0.0559,0.0008,2.9442,g00000331,1,True,1.0,needs_review_low_sim,"[""earnings_report"", ""capital_raise_rights_issue"", ""agm_egm_governance""]","[0.0559, 0.0551, 0.053]"
19904fde68933997,2025-09-01,Integrum AB,unknown,gmail,,earnings_report,Earnings report,0.0547,0.0007,needs_review_low_sim,Correction of Figures in Interim Report for the First Quarter 2025/26,"Correction of Figures in Interim Report for the First Quarter 2025/26 Published: 2025-09-01 13:16:07 CEST COMPANY - Interim report (Q1 and Q3) Correction of Figures in Interim Report for the First Quarter 2025/26 When publishing the interim report for the company, it was discovered that some of the total sums in the income statement show the wrong amounts. The sum of Net Sales and Work Performed by Own Use and Activated has mistakenly included Other operating income. Moreover, Other operating expenses was summed erroneously leading to that the sum for Total Expenses showed an incorrect amount.",2025-09-02T130606Z,v3,0.0537,0.0561,2.9444,2.9441,2.9443,0.1622,True,earnings_report,0.0547,0.0007,2.9443,g00000172,1,True,1.0,needs_review_low_sim,"[""earnings_report"", ""personnel_management_change"", ""equity_actions_non_buyback""]","[0.0547, 0.054, 0.0536]"
198ef7a0ec8f3dc9,2025-08-28,Genexis Group AB,unknown,gmail,,debt_bond_issue,Debt / Bond issue,0.0566,0.0024,needs_review_low_sim,COMPANY (publ) initiates consultations with its bondholders for the purpose of amending the terms and conditions of its senior secured bonds,"COMPANY (publ) initiates consultations with its bondholders for the purpose of amending the terms and conditions of its senior secured bonds Published: 2025-08-28 09:00:00 CEST COMPANY - Other information disclosed according to the rules of the Exchange COMPANY (publ) initiates consultations with its bondholders for the purpose of amending the terms and conditions of its senior secured bonds COMPANY (publ) (the "" Company "") announces that the Company has initiated consultations with holders of its outstanding senior secured sustainability-linked bond with ISIN SE0018040891 (the "" Bonds "") (the",2025-09-02T130606Z,v3,0.0538,0.0611,2.9444,2.9436,2.9442,0.1641,False,debt_bond_issue,0.0566,0.0024,2.9442,g00000332,1,True,1.0,needs_review_low_sim,"[""debt_bond_issue"", ""share_buyback"", ""mna""]","[0.0566, 0.0542, 0.0533]"
198f4699485140c7,2025-08-29,Episurf Medical AB,unknown,gmail,,equity_actions_non_buyback,Equity actions (non-buyback),0.0537,0.0001,needs_review_low_sim,COMPANY changes liquidity provider to Mangold Fondkommission AB,"COMPANY changes liquidity provider to Mangold Fondkommission AB Published: 2025-08-29 08:00:00 CEST COMPANY - Other information disclosed according to the rules of the Exchange COMPANY changes liquidity provider to Mangold Fondkommission AB COMPANY (""COMPANY"") (Nasdaq: EPIS B) today announces that the company is changing liquidity provider from Pareto Securities AB to Mangold Fondkommission AB (""Mangold"") as of August 29, 2025. COMPANY has entered into an agreement with Mangold regarding the role as liquidity provider. Mangold will commence the role on August 29, 2025. The liquidity provider c",2025-09-02T130606Z,v3,0.0541,0.0545,2.9444,2.9443,2.9444,0.161,False,equity_actions_non_buyback,0.0537,0.0001,2.9444,g00000333,1,True,1.0,needs_review_low_sim,"[""equity_actions_non_buyback"", ""dividend"", ""personnel_management_change""]","[0.0537, 0.0536, 0.0536]"
19854c64b76ea21a,2025-07-29,AstraZeneca,unknown,gmail,,earnings_report,Earnings report,0.054,0.0004,needs_review_low_sim,H1 and Q2 2025 results,"Click here (to view online. Add this email (mailto:) to your safelist. COMPANY logo H1 and Q2 2025 results 29 July 2025 Pascal Soriot, Chief Executive Officer, COMPANY, commenting on the results said: ""Our strong momentum in revenue growth continued through the first half of the year and the delivery from our broad and diverse pipeline has been excellent, with 12 positive key Phase III trial readouts including for baxdrostat, gefurulimab, and Tagrisso in just the past few weeks."" Read more (RSS Feed (Follow us on X (Follow us on LinkedIn (Legal notice and Terms of Use (Privacy policy (Cookie p",2025-09-02T130606Z,v3,0.0534,0.0548,2.9444,2.9443,2.9444,0.1606,True,earnings_report,0.054,0.0004,2.9444,g00000334,1,True,1.0,needs_review_low_sim,"[""earnings_report"", ""orders_contracts"", ""personnel_management_change""]","[0.054, 0.0536, 0.053]"
1984fa2b0a2b23e6,2025-07-28,AstraZeneca,unknown,gmail,,dividend,Dividend,0.0532,0.0,needs_review_low_sim,Imfinzi granted Priority Review and Breakthrough Therapy Designation in the US for patients with resectable early-stage gastric and gastroesophageal j,"Click here (to view online. Add this email (mailto:) to your safelist. COMPANY logo Imfinzi granted Priority Review and Breakthrough Therapy Designation in the US for patients with resectable early-stage gastric and gastroesophageal junction cancers 28 July 2025 COMPANY's supplemental Biologics License Application (sBLA) for Imfinzi (durvalumab) has been accepted and granted Priority Review in the US for the treatment of patients with resectable, early-stage and locally advanced (Stages II, III, IVA) gastric and gastroesophageal junction (GEJ) cancers. Read more (RSS Feed (Follow us on X (Foll",2025-09-02T130606Z,v3,0.0537,0.054,2.9444,2.9444,2.9444,0.1592,False,dividend,0.0532,0.0,2.9444,g00000335,1,True,1.0,needs_review_low_sim,"[""dividend"", ""legal_regulatory_compliance"", ""incidents_controversies""]","[0.0532, 0.0531, 0.0529]"
1979115c54e3f594,2025-06-21,AstraZeneca,unknown,gmail,,agm_egm_governance,AGM/EGM & governance,0.054,0.0002,needs_review_low_sim,Alexion data presented at EAN 2025 highlights its leadership and commitment to improving patient outcomes in rare neurological diseases,"Click here (to view online. Add this email (mailto:) to your safelist. COMPANY logo Alexion data presented at EAN 2025 highlights its leadership and commitment to improving patient outcomes in rare neurological diseases 21 June 2025 Alexion, COMPANY Rare Disease, will present seven abstracts, including four oral presentations, from its leading rare neurology portfolio at the European Academy of Neurology (EAN) Annual Congress in Helsinki, Finland, 21 to 24 June 2025. Read more (RSS Feed (Follow us on X (Follow us on LinkedIn (Legal notice and Terms of Use (Privacy policy (Cookie policy (Site m",2025-09-02T130606Z,v3,0.0536,0.0561,2.9444,2.9442,2.9444,0.1608,False,agm_egm_governance,0.054,0.0002,2.9444,g00000336,1,True,1.0,needs_review_low_sim,"[""agm_egm_governance"", ""incidents_controversies"", ""dividend""]","[0.054, 0.0538, 0.053]"
19841335422341a8,2025-07-25,AstraZeneca,unknown,gmail,,legal_regulatory_compliance,Legal / Regulatory / Compliance,0.0533,0.0001,needs_review_low_sim,Trixeo Aerosphere receives positive EU CHMP opinion as first inhaled medicine using next-generation propellant with near-zero Global Warming Potential,"Click here (to view online. Add this email (mailto:) to your safelist. COMPANY logo Trixeo Aerosphere receives positive EU CHMP opinion as first inhaled medicine using next-generation propellant with near-zero Global Warming Potential 25 July 2025 COMPANY's Trixeo Aerosphere (budesonide/glycopyrronium/formoterol fumarate or BGF), already licensed for the treatment of chronic obstructive pulmonary disease (COPD) in adults, has received a positive opinion from the Committee for Medicinal Products for Human Use (CHMP) of the European Medicines Agency, endorsing it for use in the European Union (E",2025-09-02T130606Z,v3,0.0536,0.0541,2.9443,2.9444,2.9444,0.1595,False,incidents_controversies,0.0533,0.0001,2.9444,g00000337,1,True,1.0,needs_review_low_sim,"[""incidents_controversies"", ""admission_listing"", ""product_launch_partnership""]","[0.0533, 0.0532, 0.053]"
1982b9420dc6c7ab,2025-07-21,AstraZeneca,unknown,gmail,,orders_contracts,Orders / Contracts,0.0541,0.0007,needs_review_low_sim,Tagrisso plus chemotherapy demonstrated statistically significant and clinically meaningful improvement in overall survival in EGFR-mutated advanced l,Click here (to view online. Add this email (mailto:) to your safelist. COMPANY logo Tagrisso plus chemotherapy demonstrated statistically significant and clinically meaningful improvement in overall survival in EGFR-mutated advanced lung cancer 21 July 2025 Positive high-level results from the final overall survival (OS) analysis of the FLAURA2 Phase III trial showed COMPANY's Tagrisso (osimertinib) with the addition of pemetrexed and platinum-based chemotherapy demonstrated a statistically significant and clinically meaningful improvement in the key secondary endpoint of OS compared to Tagris,2025-09-02T130606Z,v3,0.0536,0.0549,2.9444,2.9444,2.9444,0.1604,False,orders_contracts,0.0541,0.0007,2.9444,g00000338,1,True,1.0,needs_review_low_sim,"[""orders_contracts"", ""equity_actions_non_buyback"", ""admission_delisting""]","[0.0541, 0.0534, 0.0528]"
197d408b69e4d66c,2025-07-04,AstraZeneca,unknown,gmail,,dividend,Dividend,0.0533,0.0001,needs_review_low_sim,Imfinzi approved in the EU for bladder cancer,"Click here (to view online. Add this email (mailto:) to your safelist. COMPANY logo Imfinzi approved in the EU as first and only perioperative immunotherapy for muscle-invasive bladder cancer 4 July 2025 COMPANY's Imfinzi (durvalumab) has been approved in the European Union (EU) for the treatment of adult patients with resectable muscle-invasive bladder cancer (MIBC) in combination with gemcitabine and cisplatin as neoadjuvant treatment, followed by Imfinzi as monotherapy adjuvant treatment after radical cystectomy (surgery to remove the bladder). Read more (RSS Feed (Follow us on X (Follow us",2025-09-02T130606Z,v3,0.0539,0.0543,2.9444,2.9444,2.9444,0.1595,False,dividend,0.0533,0.0001,2.9444,g00000339,1,True,1.0,needs_review_low_sim,"[""dividend"", ""incidents_controversies"", ""legal_regulatory_compliance""]","[0.0533, 0.0532, 0.0531]"
198ec1c6884f879e,2025-08-27,STG Global Finance B.V,unknown,gmail,,earnings_report,Earnings report,0.0568,0.0026,needs_review_low_sim,"COMPANY. - Interim Report, Scandinavian Tobacco Group A/S","COMPANY. - Interim Report, Scandinavian Tobacco Group A/S Published: 2025-08-27 17:19:00 CEST COMPANY - Half Year financial report COMPANY. - Interim Report, Scandinavian Tobacco Group A/S Company Announcement No. 03/2025 Copenhagen, 27 August 2025 COMPANY. - Interim Report, Scandinavian Tobacco Group A/S On 27 August 2025, Scandinavian Tobacco Group A/S published its interim report for 1 April - 30 June 2025. The Annual Report and company announcement of Scandinavian Tobacco Group A/S relating to the published reports are available at:. Fo r further information, please contact: Torben Sand, D",2025-09-02T130606Z,v3,0.0543,0.0605,2.9444,2.9437,2.9442,0.1637,True,earnings_report,0.0568,0.0026,2.9442,g00000340,1,True,1.0,needs_review_low_sim,"[""earnings_report"", ""personnel_management_change"", ""other_corporate_update""]","[0.0568, 0.0541, 0.0528]"
198eaa2bd5c2c942,2025-08-27,Cemat A/S,unknown,gmail,,earnings_report,Earnings report,0.056,0.0018,needs_review_low_sim,No. 13/2025 - Interim report H1 2025,"No. 13/2025 - Interim report H1 2025 Published: 2025-08-27 10:26:20 CEST COMPANY - Half Year financial report No. 13/2025 - Interim report H1 2025 Nasdaq Copenhagen Nikolaj Plads 6 DK-1067 Copenhagen K Copenhagen, 27 August 2025 ANNOUNCEMENT no. 13/2025 INTERIM REPORT, H1 2025 The company has today published the Interim Report for H1 2025 (covering the period from 1 January 2025 to 30 June 2025). The Interim Report is attached to this company announcement and can be downloaded from the company's website. COMPANY Jaroslaw Lipinski CEO This announcement has been prepared in a Danish-language and",2025-09-02T130606Z,v3,0.0539,0.0592,2.9444,2.9439,2.9443,0.1629,True,earnings_report,0.056,0.0018,2.9443,g00000341,1,True,1.0,needs_review_low_sim,"[""earnings_report"", ""personnel_management_change"", ""admission_delisting""]","[0.056, 0.0542, 0.0528]"
198ad632258ff45a,2025-08-15,Klarna Holding AB,unknown,gmail,,earnings_report,Earnings report,0.0566,0.0027,needs_review_low_sim,COMPANY Publishes H1'25 Interim Report,"COMPANY Publishes H1'25 Interim Report Published: 2025-08-15 13:00:00 CEST COMPANY - Half Year financial report COMPANY Publishes H1'25 Interim Report NOT FOR DISTRIBUTION IN THE UNITED STATES OR OVER UNITED STATES WIRE SERVICES Stockholm, 15 August 2025 COMPANY, a subsidiary of COMPANY Group plc, and COMPANY Bank AB, a subsidiary of COMPANY, shared its H1'25 Interim Report. It is now available on COMPANY's Investor Relations website. Attachments: 08151210.pdf This email message was delivered to Cancel this subscription This news release was distributed by Company News System, nasdaq.com/europ",2025-09-02T130606Z,v3,0.0543,0.0601,2.9444,2.9438,2.9442,0.1635,True,earnings_report,0.0566,0.0027,2.9442,g00000342,1,True,1.0,needs_review_low_sim,"[""earnings_report"", ""personnel_management_change"", ""other_corporate_update""]","[0.0566, 0.0539, 0.053]"
